{
  "ask": "A 20 tooth spur gear, module 1, 6 mm thick, with a 5 mm D-shaft bore.",
  "confirmation": {
    "by": "user",
    "note": "Evaluation fixture. The evaluator simulated this confirmation and the answers to the open questions.",
    "status": "confirmed"
  },
  "envelope": {
    "size_mm": [
      21.989,
      21.989,
      6
    ],
    "tolerance_mm": 0.05
  },
  "features": [
    {
      "axis": "z",
      "depth": "through",
      "diameter_mm": 5,
      "id": "bore",
      "kind": "hole",
      "position_mm": [
        10.9945,
        10.9945
      ],
      "source": "5 mm D-shaft bore",
      "tolerance_mm": 0.05
    },
    {
      "id": "face-low",
      "kind": "planar_face",
      "min_area_mm2": 250,
      "normal": "-z",
      "offset": "min",
      "source": "6 mm thick",
      "tolerance_mm": 0.05
    },
    {
      "id": "teeth",
      "kind": "note",
      "source": "20 tooth spur gear, module 1",
      "text": "20 involute teeth, module 1, 20 degree pressure angle."
    },
    {
      "id": "d-flat",
      "kind": "note",
      "source": "D-shaft bore",
      "text": "The bore has a flat 4.5 mm across for the D-shaft."
    }
  ],
  "schema_version": "intent.v1",
  "solid_count": 1,
  "units": "mm",
  "unknowns": [
    "mating gear",
    "backlash",
    "printer and material"
  ]
}
