{
  "ask": "Mounting plate 50 x 20 x 3 with an adjustment slot in the middle, 5 mm wide and 20 mm long, and a 4 mm hole 6 mm in from each end.",
  "confirmation": {
    "by": "user",
    "note": "Evaluation fixture. The evaluator simulated this confirmation and the answers to the open questions. Revision: the slot walls are 15 mm of flat between the round ends (45 mm2 each), so they get a maximum area too. A longer slot now fails. Attempt 3: the round slot ends are measured as two half holes.",
    "status": "confirmed"
  },
  "envelope": {
    "size_mm": [
      50,
      20,
      3
    ],
    "tolerance_mm": 0.05
  },
  "features": [
    {
      "axis": "z",
      "depth": "through",
      "diameter_mm": 4,
      "id": "hole-left",
      "kind": "hole",
      "position_mm": [
        6,
        10
      ],
      "source": "a 4 mm hole 6 mm in from each end",
      "tolerance_mm": 0.05
    },
    {
      "axis": "z",
      "depth": "through",
      "diameter_mm": 4,
      "id": "hole-right",
      "kind": "hole",
      "position_mm": [
        44,
        10
      ],
      "source": "a 4 mm hole 6 mm in from each end",
      "tolerance_mm": 0.05
    },
    {
      "id": "slot-wall-low",
      "kind": "planar_face",
      "max_area_mm2": 46,
      "min_area_mm2": 44,
      "normal": "+y",
      "offset": 7.5,
      "source": "slot 5 mm wide",
      "tolerance_mm": 0.05
    },
    {
      "id": "slot-wall-high",
      "kind": "planar_face",
      "max_area_mm2": 46,
      "min_area_mm2": 44,
      "normal": "-y",
      "offset": 12.5,
      "source": "slot 5 mm wide",
      "tolerance_mm": 0.05
    },
    {
      "axis": "z",
      "diameter_mm": 5,
      "id": "slot-end-1",
      "kind": "partial_hole",
      "length_mm": 3,
      "max_arc_deg": 185,
      "min_arc_deg": 175,
      "position_mm": [
        17.5,
        10
      ],
      "source": "slot 5 mm wide and 20 mm long",
      "tolerance_mm": 0.05
    },
    {
      "axis": "z",
      "diameter_mm": 5,
      "id": "slot-end-2",
      "kind": "partial_hole",
      "length_mm": 3,
      "max_arc_deg": 185,
      "min_arc_deg": 175,
      "position_mm": [
        32.5,
        10
      ],
      "source": "slot 5 mm wide and 20 mm long",
      "tolerance_mm": 0.05
    }
  ],
  "schema_version": "intent.v1",
  "solid_count": 1,
  "units": "mm",
  "unknowns": [
    "screw size for the slot",
    "printer and material"
  ]
}
