{
  "ask": "A 20 tooth spur gear, module 1, 6 mm thick, with a 5 mm D-shaft bore.",
  "confirmation": {
    "by": "user",
    "note": "Evaluation fixture. The evaluator simulated this confirmation and the answers to the open questions. Revision: a D-bore is not a full cylinder, so it cannot be a measured hole. Moved to a note.",
    "status": "confirmed"
  },
  "envelope": {
    "size_mm": [
      21.989,
      21.989,
      6
    ],
    "tolerance_mm": 0.05
  },
  "features": [
    {
      "id": "face-low",
      "kind": "planar_face",
      "min_area_mm2": 250,
      "normal": "-z",
      "offset": "min",
      "source": "6 mm thick",
      "tolerance_mm": 0.05
    },
    {
      "id": "teeth",
      "kind": "note",
      "source": "20 tooth spur gear, module 1",
      "text": "20 involute teeth, module 1, 20 degree pressure angle."
    },
    {
      "id": "d-flat",
      "kind": "note",
      "source": "D-shaft bore",
      "text": "The bore has a flat 4.5 mm across for the D-shaft."
    },
    {
      "id": "bore",
      "kind": "note",
      "source": "5 mm D-shaft bore",
      "text": "5 mm bore for the D-shaft, centred on the gear."
    }
  ],
  "schema_version": "intent.v1",
  "solid_count": 1,
  "units": "mm",
  "unknowns": [
    "mating gear",
    "backlash",
    "printer and material"
  ]
}
